Small Rubber Tuna Num. 1,$113.88,$5.50,1.34,Jonathan
Sleek Concrete Shirt Num. 1,$239.36,$4.30,3.45,Josh
Rustic Concrete Hat Num. 1,$220.26,$4.40,1.70,Adam
Handcrafted Frozen Table Num. 1,$61.44,$17.66,2.21,Hallie
Refined Fresh Tuna Num. 1,$98.55,$13.04,1.30,Adam
Sleek Plastic Pants Num. 1,$1.21,$23.28,3.61,Jonathan
Small Plastic Shirt Num. 1,$294.58,$33.36,4.34,Hao-Han
Generic Soft Chips Num. 1,$328.27,$14.08,2.04,Amazon
Generic Concrete Cheese Num. 1,$274.34,$13.39,0.85,Josh
Practical Cotton Gloves Num. 1,$145.09,$10.93,3.78,Josh
Small Rubber Chair Num. 1,$271.74,$21.44,0.76,Hallie
Gorgeous Fresh Chicken Num. 1,$133.66,$4.90,3.32,Jonathan
Tasty Rubber Car Num. 1,$182.35,$24.97,2.27,Adam
Sleek Frozen Car Num. 1,$6.61,$3.20,3.04,Josh
Unbranded Wooden Hat Num. 1,$373.47,$35.57,4.40,Adam
Gorgeous Steel Keyboard Num. 1,$11.36,$28.93,3.17,Amazon
Generic Rubber Gloves Num. 1,$275.12,$3.61,2.82,Hallie
Awesome Metal Sausages Num. 1,$274.77,$34.62,4.84,Adam
Generic Metal Bike Num. 1,$155.06,$19.00,2.03,Adam
Gorgeous Frozen Fish Num. 1,$84.41,$30.96,4.34,Adam
Ergonomic Soft Table Num. 1,$353.09,$44.65,0.89,Adam
Fantastic Rubber Salad Num. 1,$270.62,$2.72,3.10,Josh
Awesome Plastic Bacon Num. 1,$206.39,$45.92,1.15,Adam
Sleek Steel Bacon Num. 1,$255.40,$31.84,1.87,Jonathan
Rustic Concrete Pants Num. 1,$383.72,$10.92,3.85,Jonathan
Handcrafted Cotton Hat Num. 1,$297.35,$0.24,4.85,Hao-Han
Small Soft Salad Num. 1,$167.24,$9.58,1.28,Adam
Gorgeous Plastic Tuna Num. 1,$255.68,$41.40,4.23,Amazon
Practical Cotton Car Num. 1,$251.66,$41.91,0.63,Amazon
Refined Metal Gloves Num. 1,$64.32,$23.24,0.47,Amazon
Rustic Granite Towels Num. 1,$227.91,$46.63,1.61,Hao-Han
Unbranded Steel Tuna Num. 1,$86.46,$43.66,3.75,Hao-Han
Licensed Rubber Towels Num. 1,$141.66,$25.69,3.46,Hallie
Intelligent Steel Keyboard Num. 1,$137.10,$22.31,3.34,Adam
Tasty Rubber Bike Num. 1,$198.33,$45.50,3.14,Jonathan
Handcrafted Cotton Chair Num. 1,$68.57,$26.01,3.77,Hao-Han
Unbranded Soft Chips Num. 1,$170.36,$31.32,1.50,Hallie
Fantastic Granite Pants Num. 1,$22.34,$29.42,3.95,Adam
Handcrafted Concrete Towels Num. 1,$55.06,$11.03,2.69,Josh
Refined Metal Shoes Num. 1,$240.86,$9.82,0.98,Adam
Intelligent Rubber Cheese Num. 1,$112.59,$2.48,2.00,Hao-Han
Sleek Rubber Keyboard Num. 1,$361.43,$49.39,4.02,Jonathan
Fantastic Granite Chair Num. 1,$200.37,$4.65,2.07,Adam
Incredible Plastic Towels Num. 1,$41.78,$35.71,1.03,Adam
Handmade Concrete Bike Num. 1,$271.46,$32.35,1.12,Josh
Unbranded Rubber Salad Num. 1,$330.56,$1.37,1.53,Amazon
Gorgeous Metal Towels Num. 1,$48.65,$32.55,3.25,Hallie
Generic Concrete Table Num. 1,$294.45,$17.58,0.62,Adam
Small Concrete Tuna Num. 1,$184.70,$2.10,1.13,Walmart
Refined Concrete Sausages Num. 1,$357.45,$42.31,0.43,Hallie
Incredible Granite Soap Num. 1,$71.82,$45.28,1.80,Hao-Han
Handcrafted Wooden Shoes Num. 1,$162.06,$44.29,0.53,Amazon
Small Steel Shoes Num. 1,$220.84,$11.49,3.39,Amazon
Sleek Steel Tuna Num. 1,$210.24,$41.87,3.91,Jonathan
Sleek Wooden Mouse Num. 1,$20.45,$29.91,2.05,Walmart
Generic Wooden Salad Num. 1,$79.49,$18.59,4.67,Hallie
Awesome Fresh Pants Num. 1,$255.66,$13.22,4.12,Hallie
Practical Concrete Chair Num. 1,$85.44,$15.83,3.04,Walmart
Incredible Concrete Shirt Num. 1,$347.28,$32.66,3.17,Hallie
Tasty Concrete Fish Num. 1,$194.31,$27.40,0.87,Josh
Small Steel Bike Num. 1,$337.86,$29.64,4.21,Jonathan
Fantastic Wooden Bike Num. 1,$151.15,$25.17,1.10,Hao-Han
Incredible Plastic Table Num. 1,$201.75,$27.02,0.54,Josh
Sleek Plastic Tuna Num. 1,$206.18,$49.93,4.57,Hao-Han
Gorgeous Cotton Computer Num. 1,$328.87,$48.10,4.97,Walmart
Tasty Metal Towels Num. 1,$320.68,$24.54,1.54,Adam
Handmade Plastic Hat Num. 1,$131.12,$32.62,1.40,Hao-Han
Handcrafted Frozen Car Num. 1,$6.97,$37.68,3.32,Jonathan
Rustic Cotton Pizza Num. 1,$50.41,$2.91,1.67,Hao-Han
Licensed Metal Shirt Num. 1,$305.11,$20.49,1.32,Hao-Han
Practical Cotton Bike Num. 1,$114.92,$23.33,2.53,Josh
Rustic Frozen Table Num. 1,$52.24,$18.92,1.97,Adam
Practical Cotton Computer Num. 1,$85.86,$15.32,3.91,Adam
Awesome Plastic Fish Num. 1,$286.97,$25.82,0.91,Jonathan
Ergonomic Frozen Sausages Num. 1,$322.04,$8.59,0.42,Jonathan
Sleek Granite Soap Num. 1,$55.14,$31.87,3.45,Hao-Han
Ergonomic Cotton Table Num. 1,$186.63,$43.07,2.36,Adam
Small Fresh Table Num. 1,$375.96,$40.38,1.95,Walmart
Fantastic Cotton Keyboard Num. 1,$391.02,$21.06,3.11,Adam
Generic Metal Cheese Num. 1,$43.87,$14.70,1.00,Walmart
Handcrafted Steel Computer Num. 1,$96.11,$30.92,2.33,Adam
Ergonomic Metal Ball Num. 1,$10.29,$49.32,0.80,Walmart
Incredible Rubber Hat Num. 1,$325.85,$46.91,4.59,Walmart
Handmade Fresh Chips Num. 1,$299.89,$38.29,0.72,Hao-Han
Generic Rubber Hat Num. 1,$187.04,$45.81,2.11,Jonathan
Small Granite Mouse Num. 1,$234.21,$17.97,1.39,Josh
Refined Rubber Soap Num. 1,$131.04,$45.70,1.18,Adam
Rustic Plastic Computer Num. 1,$37.43,$40.58,4.76,Hallie
Practical Steel Table Num. 1,$216.60,$8.86,4.12,Hallie
Rustic Steel Gloves Num. 1,$330.35,$14.69,0.95,Walmart
Ergonomic Cotton Sausages Num. 1,$184.57,$6.89,3.79,Josh
Tasty Concrete Fish Num. 1,$145.92,$27.26,2.80,Josh
Gorgeous Fresh Chicken Num. 1,$174.14,$7.16,1.29,Hao-Han
Awesome Steel Shoes Num. 1,$268.11,$17.48,3.81,Jonathan
Handmade Concrete Fish Num. 1,$261.19,$39.31,1.96,Adam
Practical Metal Mouse Num. 1,$191.04,$30.65,0.54,Hallie
Sleek Plastic Sausages Num. 1,$266.05,$11.85,3.81,Josh
Sleek Fresh Chair Num. 1,$361.13,$23.79,2.74,Hallie
Gorgeous Cotton Pants Num. 1,$42.44,$27.19,2.77,Jonathan
Small Fresh Bacon Num. 1,$380.20,$17.46,2.49,Walmart